{
  "$schema": "https://openpresentation.org/schema/opf-language/v1",
  "id": "chinese-traditional",
  "name": "Chinese (Traditional)",
  "code": "ZHO",
  "bcp47": "zh-Hant",
  "ooxmlLang": "zh-TW",
  "script": "Hant",
  "direction": "ltr",
  "fontScheme": "microsoft-jhenghei",
  "googleFontScheme": "noto-sans-tc"
}
